--
-- test.sql
--
create extension pg_iot;
--
create table t(x int);
insert into t values(1);
select * from t;
 x 
---
 1
(1 row)

update t set x=2;
select * from t;
 x 
---
 2
(1 row)

delete from t;
select * from t;
 x 
---
(0 rows)

--
select pg_iot_set('public','t');
 pg_iot_set 
------------
 t
(1 row)

insert into t values(1);
select * from t;
 x 
---
 1
(1 row)

delete from t;
ERROR:  pg_iot: UPDATE and DELETE operations are disabled on table "public.t"
select * from t;
 x 
---
 1
(1 row)

update t set x=2;
ERROR:  pg_iot: UPDATE and DELETE operations are disabled on table "public.t"
select * from t;
 x 
---
 1
(1 row)

