--
-- test.sql
--
create extension pg_iot;
--
create table t(x int);
--
insert into t values(1);
select * from t;
 x 
---
 1
(1 row)

update t set x=2;
select * from t;
 x 
---
 2
(1 row)

delete from t;
select * from t;
 x 
---
(0 rows)

--
select iot.pg_iot_set('public','t');
 pg_iot_set 
------------
 t
(1 row)

insert into t values(1);
select * from t;
 x 
---
 1
(1 row)

delete from t;
ERROR:  pg_iot: UPDATE and DELETE and MERGE operations are disabled on table "public.t"
select * from t;
 x 
---
 1
(1 row)

update t set x=2;
ERROR:  pg_iot: UPDATE and DELETE and MERGE operations are disabled on table "public.t"
select * from t;
 x 
---
 1
(1 row)

--
create table m(y int);
--
merge into m as target
using t as source
on target.y = source.x 
when matched then
    update set y = 2
when not matched then
    insert (y)
    values(3);
ERROR:  pg_iot: UPDATE and DELETE and MERGE operations are disabled on table "public.t"
